{
  "enabled": true,
  "provider_id": "aliyun-bailian-token-plan-beijing",
  "base_url": "https://token-plan.cn-beijing.maas.aliyuncs.com/compatible-mode/v1",
  "model": "deepseek-v4-flash-0731",
  "api_key_env": "DASHSCOPE_API_KEY",
  "api_style": "openai_chat_completions",
  "json_output_mode": "native",
  "thinking_mode": "disabled",
  "max_calls": 1,
  "timeout_seconds": 120,
  "max_output_tokens": 8192,
  "temperature": 0,
  "authorization_id": "user-approved-aliyun-token-plan-deepseek-v4-flash-0731-2026-08-20"
}
